question,course,document
"I'm getting a 'NameError' in my Python code on Windows, but I can't figure out why.  I ran the code from a Jupyter Notebook and followed along with Video 3, but the error message doesn't give a line number. What should I do?",data-engineering-zoomcamp,a820b9b3
"My C++ program compiles fine, but crashes when I run it on macOS. The error message says 'Segmentation fault: 11'.  I've tried restarting my computer, but nothing helped.  How do I provide enough info for you to help?",data-engineering-zoomcamp,a820b9b3
I'm working on the Java assignment from the last week. I'm using IntelliJ on Linux and I keep getting a compiler error about an 'unresolved symbol'.  I've checked for typos and the error message doesn't give a line number. Where can I get more information on how to debug this?,data-engineering-zoomcamp,a820b9b3
"I followed the instructions in Video 5 to set up my environment, but I'm still getting an error when I try to run the example code.  I'm using a Mac, and I've attached the error log as a screenshot. What information do you still need from me?",data-engineering-zoomcamp,a820b9b3
"The troubleshooting guide mentioned in the FAQ didn't help with my problem.  I'm getting a 'TypeError' in my JavaScript code on my Linux machine.  I was following along with the code in the tutorial on the course website, specifically the section on arrays. I've tried restarting the browser, but nothing fixed it. What additional details should I include in my question?",data-engineering-zoomcamp,a820b9b3
What if I don't have a GitHub account yet?  Do I need to make one immediately?,data-engineering-zoomcamp,f2945cd2
The video on cloning repositories seems a bit complicated. Are there any written instructions I can follow instead?,data-engineering-zoomcamp,f2945cd2
I'm not sure I understand pull requests. Could you give a simpler explanation of why and when I would use them for this course?,data-engineering-zoomcamp,f2945cd2
The .gitignore file seems important. Are there any examples of what I should include in mine for this class?,data-engineering-zoomcamp,f2945cd2
The FAQ mentions avoiding passwords and keys in Git. What are the risks if I don't follow this advice?,data-engineering-zoomcamp,f2945cd2
What does 'Makefile:2: *** missing separator. Stop.' actually mean in the context of VS Code and tabs?,data-engineering-zoomcamp,eb9d376f
How do I convert tabs to spaces or spaces to tabs in VS Code?  The FAQ answer isn't clear on the process.,data-engineering-zoomcamp,eb9d376f
Is there a specific VS Code extension or setting I should use to ensure consistent tab/space usage?,data-engineering-zoomcamp,eb9d376f
The FAQ says to 'Follow this stack'.  What stack is being referred to?  Is there a link or more detailed instructions?,data-engineering-zoomcamp,eb9d376f
"If I'm not using Makefiles, could this 'missing separator' error still apply to my code in VS Code and how I handle tabs and spaces?",data-engineering-zoomcamp,eb9d376f
"What if I don't have WSL2 installed, only WSL1?",data-engineering-zoomcamp,72f25f6d
"Can I use this method to open other types of files besides HTML, like PDFs or images?",data-engineering-zoomcamp,72f25f6d
"If I set the BROWSER environment variable, will that affect other applications running on WSL?",data-engineering-zoomcamp,72f25f6d
Is there a way to do this without having to install `wslu`?,data-engineering-zoomcamp,72f25f6d
My Windows browser path contains spaces; how should I handle that in the `export BROWSER` command?,data-engineering-zoomcamp,72f25f6d
"Can you clarify the unzip command for the Taxi Data?  The FAQ says 'unzip' won't work, but doesn't explain the alternative fully.",data-engineering-zoomcamp,a1e59afc
"Is there a video tutorial for setting up Chrome Remote Desktop on Compute Engine, or are there any other resources besides the one mentioned?",data-engineering-zoomcamp,a1e59afc
"If the TLC website link is broken, will you update the FAQ with a working link in the future?",data-engineering-zoomcamp,a1e59afc
What other operating systems are supported by Chrome Remote Desktop besides Debian Linux in the context of this module?,data-engineering-zoomcamp,a1e59afc
"For the Taxi Data, are there instructions for handling the data after unzipping it?  Like how to import into a program like Python",data-engineering-zoomcamp,a1e59afc
Can we use a different method besides `url.split('/')[-1]` to extract the filename from the URL?,data-engineering-zoomcamp,71c10610
The FAQ mentions pandas can read `.csv.gz` directly.  Are there any performance implications compared to unzipping first?,data-engineering-zoomcamp,71c10610
"If the URL structure changes, will the `url.split('/')[-1]` method still work reliably?",data-engineering-zoomcamp,71c10610
What happens if the downloaded file is corrupted or not a valid `.csv.gz` file? How does the code handle errors?,data-engineering-zoomcamp,71c10610
"Are there any examples of how to implement error handling (e.g., try-except blocks) when reading the `.csv.gz` file?",data-engineering-zoomcamp,71c10610
Are there data dictionaries available for other NYC taxi datasets besides Yellow and Green trips?,data-engineering-zoomcamp,17a5aea1
"Where can I find information about the data formats (e.g., CSV, JSON) for the taxi trip records?",data-engineering-zoomcamp,17a5aea1
What is the meaning of all the different columns in the provided data dictionaries?,data-engineering-zoomcamp,17a5aea1
How often is the data dictionary updated; should I expect changes to column names and descriptions?,data-engineering-zoomcamp,17a5aea1
"Is there a single, consolidated data dictionary that covers both yellow and green taxi trip data?",data-engineering-zoomcamp,17a5aea1
"If the file isn't named 'green_tripdata_2019-09.csv.gz', how do I adapt the unzip command?",data-engineering-zoomcamp,5a275db7
"In the ingest_data.py solution,  why does it download the parquet file and then immediately convert it to a CSV? Why not just use the parquet file directly?",data-engineering-zoomcamp,5a275db7
"The FAQ says to use 'pd.read_csv()'.  Is this the only way to import the CSV after unzipping, or are there other pandas functions that could be used?",data-engineering-zoomcamp,5a275db7
The provided solution uses 'wget'. Are there alternative commands I could use to download the parquet file?,data-engineering-zoomcamp,5a275db7
What if I encounter an error during the unzip process? How can I troubleshoot it?,data-engineering-zoomcamp,5a275db7
"If I already have Git Bash installed on Windows, should I still add wget to my Git\mingw64\bin\ directory, or is there a better location?",data-engineering-zoomcamp,7ec0f9b0
"The FAQ mentions using 'brew install wget' on MacOS.  If I don't have Homebrew installed, will the instructions for installing wget via Chocolatey on Windows also work on MacOS?",data-engineering-zoomcamp,7ec0f9b0
"The FAQ suggests several ways to install wget on Windows.  Is there a recommended method for a beginner, and why is that method preferred?",data-engineering-zoomcamp,7ec0f9b0
"After installing wget using Chocolatey, I still get the 'lwget is not recognized' error. What other steps can I take to troubleshoot this?",data-engineering-zoomcamp,7ec0f9b0
The FAQ mentions using the 'requests' library in Python as an alternative to wget for downloading .gz files.  Could you provide a simple example of how to use 'requests' to download and save a .gz file?,data-engineering-zoomcamp,7ec0f9b0
Will adding the '!' before wget work in other IDEs besides Jupyter Notebook and CLI?,data-engineering-zoomcamp,bb1ba786
"If the Python wget method still fails, are there any other alternatives to download the file securely?",data-engineering-zoomcamp,bb1ba786
"What are the security implications of using the `--no-check-certificate` flag, and are there safer alternatives?",data-engineering-zoomcamp,bb1ba786
Is there a way to permanently fix the certificate verification issue on my MacOS system instead of adding the flag each time?,data-engineering-zoomcamp,bb1ba786
My download still fails even after trying both methods. What other troubleshooting steps should I take?  Could it be a problem with my network connection?,data-engineering-zoomcamp,bb1ba786
Will this command affect other terminals besides Git Bash?,data-engineering-zoomcamp,2f83dbe7
What happens if I already have an escape character set in my .bashrc file?,data-engineering-zoomcamp,2f83dbe7
Is there any performance impact from changing the escape character?,data-engineering-zoomcamp,2f83dbe7
"If I don't change the escape character, will I still be able to complete the module exercises?",data-engineering-zoomcamp,2f83dbe7
Are there any downsides to setting the backslash as the escape character?,data-engineering-zoomcamp,2f83dbe7
Is there a way to use environment variables instead of storing secrets directly in Codespaces?,data-engineering-zoomcamp,543ff080
What happens if I accidentally expose a secret in my Codespaces configuration?,data-engineering-zoomcamp,543ff080
Are there any limitations on the types of secrets I can store in GitHub Codespaces?,data-engineering-zoomcamp,543ff080
How do I revoke access to a secret if it's compromised?,data-engineering-zoomcamp,543ff080
The GitHub Docs link is broken; is there an alternative guide or tutorial on securing secrets within Codespaces?,data-engineering-zoomcamp,543ff080
What should I do if the `wsl --update` command doesn't resolve the Docker daemon connection issue?,data-engineering-zoomcamp,d407d65b
"My Docker daemon is running, but I still get the connection error; what other troubleshooting steps can I take?",data-engineering-zoomcamp,d407d65b
"The FAQ mentions checking the issue 'immediately down below', but there's nothing below the answer. Where can I find more information?",data-engineering-zoomcamp,d407d65b
Are there alternative ways to connect to the Docker daemon besides unix:///var/run/docker.sock?,data-engineering-zoomcamp,d407d65b
"If I'm using a different operating system besides Windows, how do I resolve the Docker daemon connection problem?",data-engineering-zoomcamp,d407d65b
"If I'm using Windows 10 Home, and I've followed the WSL2 instructions but still get the 'The system cannot find the file specified' error, what other troubleshooting steps should I take?",data-engineering-zoomcamp,c9375c56
The FAQ mentions enabling Hyper-V for Windows 10 Pro/11 Pro users.  Are there any performance implications to consider when using Hyper-V compared to WSL2?,data-engineering-zoomcamp,c9375c56
The link for installing WSL2 is for Windows 11. Is the process significantly different for Windows 10?,data-engineering-zoomcamp,c9375c56
What are the minimum system requirements for running Docker with WSL2 on Windows 10 Home?,data-engineering-zoomcamp,c9375c56
"The error message mentions a connection to '//./pipe/docker_engine'. What exactly is this pipe, and why is it important for Docker to access it?",data-engineering-zoomcamp,c9375c56
"If I get a 'permission denied' error when pulling a Docker image, does that always mean I need to `docker login`?",data-engineering-zoomcamp,e866156b
The FAQ mentions a typo in `dbpage/pgadmin4`.  Are there any other common typos I should watch out for when pulling images?,data-engineering-zoomcamp,e866156b
The FAQ says to use Docker Desktop instead of Rancher Desktop for macOS M1.  Are there any other system-specific considerations I should be aware of when setting up Docker for this module?,data-engineering-zoomcamp,e866156b
Why might I still get a 'permission denied' error even after correcting a typo in the image name?,data-engineering-zoomcamp,e866156b
"The FAQ addresses a 'permission denied' error related to mounted volumes on macOS M1. What should I do if I get a similar error on a different operating system (e.g., Windows or Linux)?",data-engineering-zoomcamp,e866156b
What if I don't have sudo access?  How can I delete the folder then?,data-engineering-zoomcamp,16370470
Is there a way to avoid creating these protected folders in the first place when mounting Docker volumes?,data-engineering-zoomcamp,16370470
The FAQ says to use 'sudo rm -r -f'.  Isn't that risky? Are there safer alternatives?,data-engineering-zoomcamp,16370470
"My Obsidian is also having access issues, but it's not related to a Docker volume.  Would this same command work for other folders causing access problems?",data-engineering-zoomcamp,16370470
The example uses 'docker_test/'. What should I replace this with if my folder has a different name?,data-engineering-zoomcamp,16370470
"If I'm using the Home edition of Windows 11, can I still use Docker, and if so, how?",data-engineering-zoomcamp,316df755
The FAQ mentions switching between Windows and Linux containers.  What are the performance implications of each?,data-engineering-zoomcamp,316df755
"My Docker is stuck starting, and I've already tried switching containers. What other troubleshooting steps can I take?",data-engineering-zoomcamp,316df755
The FAQ says to enable Hyper-V.  Are there any drawbacks to using Hyper-V instead of WSL2?,data-engineering-zoomcamp,316df755
"After uninstalling and reinstalling Docker, it's still not working. What further diagnostics should I run?",data-engineering-zoomcamp,316df755
What tutorial is referenced for setting up Docker with WSL2 on Windows Home edition?,data-engineering-zoomcamp,f3aa9252
"If resetting Docker to factory defaults doesn't work, what other troubleshooting steps are recommended?",data-engineering-zoomcamp,f3aa9252
Are there any performance differences between running Docker commands from the Windows filesystem versus WSL?,data-engineering-zoomcamp,f3aa9252
Does the recommendation to use WSL2 apply to Docker Desktop as well?,data-engineering-zoomcamp,f3aa9252
"My WSL2 is set up correctly, but Docker is still stuck; what constitutes a 'fresh install' in this context?",data-engineering-zoomcamp,f3aa9252
Where can I find the Docker documentation on best practices for file system performance?,data-engineering-zoomcamp,a4abe7a5
"Is using WSL2 the only way to run Docker on Windows 10 Home/11 Home, or are there alternatives with better performance?",data-engineering-zoomcamp,a4abe7a5
"If I don't store all my code in my default Linux distro on WSL2, will Docker still work, and if so, what performance impact should I expect?",data-engineering-zoomcamp,a4abe7a5
What are the specific performance benefits of storing all code in the default Linux distro when using Docker on WSL2?,data-engineering-zoomcamp,a4abe7a5
Are there any other recommendations besides storing all code in the default Linux distro to optimize Docker performance on WSL2?,data-engineering-zoomcamp,a4abe7a5
"What if I'm not using Mintty, but another terminal emulator like Cmder or Git Bash? Will winpty still work?",data-engineering-zoomcamp,fb930700
"Does the `winpty` solution work for all Docker commands, or just those using `-it`?",data-engineering-zoomcamp,fb930700
"If I add the alias to my `.bashrc` or `.bash_profile`, do I need to restart my terminal for it to take effect?",data-engineering-zoomcamp,fb930700
My Windows installation doesn't have `winpty` installed. How can I install it?,data-engineering-zoomcamp,fb930700
Are there any alternative solutions to the 'input device is not a TTY' error besides using `winpty`?,data-engineering-zoomcamp,fb930700
Why does using `winpty` solve the DNS resolution issue when installing pandas inside a Docker container on Windows?,data-engineering-zoomcamp,aa187680
What other DNS servers besides 8.8.8.8 could I use with the `--dns` flag?,data-engineering-zoomcamp,aa187680
"If I encounter a similar error with a different package besides pandas, can I still use this `winpty` and `--dns` solution?",data-engineering-zoomcamp,aa187680
Is there a way to permanently configure my Docker container to use a specific DNS server without specifying it every time I run the container?,data-engineering-zoomcamp,aa187680
My error message is slightly different; it doesn't mention name resolution but still relates to connection issues.  Is this solution still relevant or are there other troubleshooting steps for connection problems in Docker on Windows?,data-engineering-zoomcamp,aa187680
"Why is my ny_taxi_postgres_data folder still empty after running the provided Docker command, even though I've used the absolute path as instructed?",data-engineering-zoomcamp,b000e899
The FAQ solution is for Windows. What's the equivalent command for macOS or Linux?,data-engineering-zoomcamp,b000e899
"The FAQ mentions using 'winpty'. What does 'winpty' do, and is it necessary for all users?",data-engineering-zoomcamp,b000e899
My absolute path is very long. Is there a way to shorten it or use a relative path instead?,data-engineering-zoomcamp,b000e899
"After running the command, Postgres is running but the database 'ny_taxi' isn't created.  What could be the problem?",data-engineering-zoomcamp,b000e899
"Is the article on setting up Docker on macOS still relevant, given the changes to Docker's licensing?",data-engineering-zoomcamp,9c66759f
"If the article is outdated, are there any specific known compatibility issues with older instructions?",data-engineering-zoomcamp,9c66759f
Why does downloading the DMG directly from the Docker website seem to be a more reliable method than the instructions in the article?,data-engineering-zoomcamp,9c66759f
Are there any potential downsides to downloading the DMG directly from the Docker website compared to using the method described in the article?,data-engineering-zoomcamp,9c66759f
What version of Docker is recommended for completing the exercises in Module 1?,data-engineering-zoomcamp,9c66759f
Why does the error message specify 'invalid mode'? What does 'mode' refer to in this context?,data-engineering-zoomcamp,58c9f99f
Are there any other potential issues besides the mounting path that could cause this 'invalid mode' error?,data-engineering-zoomcamp,58c9f99f
The suggested solutions use different drive letters (e: and c:).  Does the choice of drive letter depend on my operating system?,data-engineering-zoomcamp,58c9f99f
"If I have other applications using the same directory, can I still use the suggested method?  What might the consequences be?",data-engineering-zoomcamp,58c9f99f
My 'Program Files' path is slightly different – it contains additional subfolders. How can I adapt the suggested solutions to work with my specific path?,data-engineering-zoomcamp,58c9f99f
Why does the error 'error while creating buildmount source path '/run/desktop/mnt/host/c/<your path>': mkdir /run/desktop/mnt/host/c: file exists' only appear on the second run of the docker command?,data-engineering-zoomcamp,bc42139a
"If I don't want to mount the volume on the second run, what are the implications for my Postgres database data?",data-engineering-zoomcamp,bc42139a
Is there a way to automatically handle this error without manually removing the mount point each time?,data-engineering-zoomcamp,bc42139a
What happens to the data in my Postgres database if I don't mount the volume on subsequent runs?,data-engineering-zoomcamp,bc42139a
"The FAQ solution suggests omitting the volume mount on subsequent runs; are there alternative solutions to avoid this error, such as using a named volume instead?",data-engineering-zoomcamp,bc42139a
"If I move the Dockerfile and ingest_data.py files to a new directory, will that affect how my other files within the original directory are processed later in the module?",data-engineering-zoomcamp,a146e3ee
"The FAQ mentions changing directory permissions.  Are there any security risks associated with using `sudo chown` and are there better, more secure ways to handle this issue?",data-engineering-zoomcamp,a146e3ee
"The provided Stack Overflow link is helpful, but it's quite general.  Are there specific Dockerfile best practices to prevent this type of 'can't stat' error in the future?",data-engineering-zoomcamp,a146e3ee
"The FAQ suggests creating a new directory.  Should this new directory be within my original project directory, or is a completely separate location better?",data-engineering-zoomcamp,a146e3ee
"My Windows machine is giving me a slightly different error message, although the root cause seems similar.  Can I still use the solutions described, or will I need to find a Windows-specific solution not included in the FAQ?",data-engineering-zoomcamp,a146e3ee
"If I uninstall Docker installed via snap, will my existing Docker images and containers be lost?",data-engineering-zoomcamp,593a85ba
"What's the official website to download Docker, and are there different versions I should be aware of for this module?",data-engineering-zoomcamp,593a85ba
The error message says 'port is already in use'. How can I identify which process is using port 5432?,data-engineering-zoomcamp,593a85ba
"After reinstalling Docker from the official website, do I need to reconfigure anything for it to work with the Terraform projects in this module?",data-engineering-zoomcamp,593a85ba
"My 'snap status docker' command shows Docker is running, but I'm still getting the 'context canceled' error.  What other troubleshooting steps should I try?",data-engineering-zoomcamp,593a85ba
Is there a less risky way to fix the permission issue than using `sudo chmod -R 777`?  I'm worried about security implications.,data-engineering-zoomcamp,50bd1a71
What if the `ny_taxi_postgres_data` folder isn't directly in my home directory? How would I adapt the `chmod` command?,data-engineering-zoomcamp,50bd1a71
The FAQ mentions a problem with authorization rights. What other authorization problems might I encounter in this module and how can I prevent them?,data-engineering-zoomcamp,50bd1a71
"Will this permission issue only occur on PopOS, or could I expect similar problems on other Linux distributions or Windows?",data-engineering-zoomcamp,50bd1a71
"If I encounter a similar build error but it's not related to permissions,  what are some other common causes and troubleshooting steps for Docker build errors?",data-engineering-zoomcamp,50bd1a71
What if using `sudo chmod -R 777 ny_taxi_postgres_data` still doesn't solve the permission denied error?,data-engineering-zoomcamp,f409f751
Why does this permission issue only seem to happen when rebuilding the Docker image?,data-engineering-zoomcamp,f409f751
Are there any security risks associated with using `chmod 777`?  Should I use a less permissive setting if possible?,data-engineering-zoomcamp,f409f751
"Is there a way to avoid this permission problem altogether, without using `sudo` every time?",data-engineering-zoomcamp,f409f751
"My operating system isn't Ubuntu/Linux; will I encounter a similar error, and if so, how would I fix it?",data-engineering-zoomcamp,f409f751
How do I create a new Docker network?,data-engineering-zoomcamp,7d217da3
What happens if I have multiple networks listed in `docker network ls`?,data-engineering-zoomcamp,7d217da3
Can I specify a custom name when creating a Docker network?,data-engineering-zoomcamp,7d217da3
Is there a way to delete a Docker network using the command line?,data-engineering-zoomcamp,7d217da3
"If I use a network name in a Docker Compose file, will it automatically create the network if it doesn't exist?",data-engineering-zoomcamp,7d217da3
"What if the `docker stop` command doesn't work, and I still get the same error?",data-engineering-zoomcamp,09081824
Is there a way to list all containers using the name 'pg-database' to make sure I'm removing the correct one?,data-engineering-zoomcamp,09081824
"If I use `docker start` instead of `docker run`, will it always avoid this conflict?",data-engineering-zoomcamp,09081824
The FAQ mentions using the appropriate container name. How do I find the exact container name if I only know a part of it?,data-engineering-zoomcamp,09081824
Are there any other common reasons for getting this 'Conflict. The container name... is already in use' error besides a running container with the same name?,data-engineering-zoomcamp,09081824
How do I find the name of the network created when I run `docker-compose up -d`?,data-engineering-zoomcamp,4df80c55
What if the database name isn't `pgdatabase` in my `docker-compose.yml` file?,data-engineering-zoomcamp,4df80c55
Is there a way to avoid this issue without having to change the ingestion script?,data-engineering-zoomcamp,4df80c55
What does the '2' prefix in `2docker_default` and `2docker-pgdatabase-1` represent?,data-engineering-zoomcamp,4df80c55
"If I'm using a different database system (e.g., MySQL), how would I adapt the solution described in the FAQ?",data-engineering-zoomcamp,4df80c55
Will these commands work if I'm using a different virtualization software besides VMware?,data-engineering-zoomcamp,3aee7261
What should I do if I get an error message after running those modprobe commands?,data-engineering-zoomcamp,3aee7261
My CPU isn't Intel or AMD; what's the equivalent command for my [specific CPU architecture]?,data-engineering-zoomcamp,3aee7261
Are there any performance implications to enabling nested virtualization?,data-engineering-zoomcamp,3aee7261
"If I'm using a pre-built VM image provided by the course, do I still need to run these commands?",data-engineering-zoomcamp,3aee7261
How do I find my container ID to use the docker stop command?,data-engineering-zoomcamp,6497b659
What if the VS Code Docker extension isn't working even after installation?,data-engineering-zoomcamp,6497b659
"Does the VS Code Docker extension support all Docker commands, or are there limitations?",data-engineering-zoomcamp,6497b659
"If my Docker Desktop is running on Windows, not WSL2, will the VS Code extension still connect correctly?",data-engineering-zoomcamp,6497b659
Are there any alternative ways to stop a Docker container besides using the command line?,data-engineering-zoomcamp,6497b659
