question,course,document
What happens if I can't make the first Office Hours live session on January 15th?,data-engineering-zoomcamp,c02e79ef
Is there a recording of the Office Hours session available if I miss it?,data-engineering-zoomcamp,c02e79ef
Where can I find the link to register for the course?,data-engineering-zoomcamp,c02e79ef
How do I subscribe to the Google Calendar from my mobile phone?,data-engineering-zoomcamp,c02e79ef
Will the course materials be available before January 15th?,data-engineering-zoomcamp,c02e79ef
"What specific programming languages should I be comfortable with before starting the course, based on the prerequisites link?",data-engineering-zoomcamp,1f6520ca
Is there a recommended level of familiarity with SQL for this course?,data-engineering-zoomcamp,1f6520ca
"The prerequisites mention Docker; how essential is prior Docker experience, and are there resources to help me learn it before starting?",data-engineering-zoomcamp,1f6520ca
"Besides the technical prerequisites, are there any recommended soft skills or prior experience with teamwork that would be beneficial?",data-engineering-zoomcamp,1f6520ca
"The GitHub link mentions several topics – are all of them equally crucial for successful course completion, or are some more important than others?",data-engineering-zoomcamp,1f6520ca
"If I join late, will I have access to all the course materials from the beginning?",data-engineering-zoomcamp,7842b56a
What happens if I miss the deadlines for the homeworks?,data-engineering-zoomcamp,7842b56a
Are there any penalties for joining the course after the start date?,data-engineering-zoomcamp,7842b56a
Will I be able to participate in any discussions or forums if I join late?,data-engineering-zoomcamp,7842b56a
"What exactly are the deadlines for the final projects, and how are they communicated?",data-engineering-zoomcamp,7842b56a
"If registration isn't mandatory, why did you even ask us to register?",data-engineering-zoomcamp,0bbf41ec
What happens if I don't submit homework?,data-engineering-zoomcamp,0bbf41ec
Is there a deadline to start the course materials?,data-engineering-zoomcamp,0bbf41ec
Will there be any consequences if I registered late?,data-engineering-zoomcamp,0bbf41ec
"Are there any benefits to registering for the course, even if it's not required?",data-engineering-zoomcamp,0bbf41ec
Is there a specific version of Python 3 and Anaconda recommended for the course?,data-engineering-zoomcamp,63394d91
Where can I find detailed instructions on installing and configuring the Google Cloud SDK?,data-engineering-zoomcamp,63394d91
What are the minimum system requirements for running the course software?,data-engineering-zoomcamp,63394d91
The syllabus mentions prerequisites in linear algebra; how crucial is this knowledge for successfully completing the course?,data-engineering-zoomcamp,63394d91
"If I'm already familiar with Git, is there any specific Git workflow or configuration you recommend for this course?",data-engineering-zoomcamp,63394d91
"If I'm not aiming for a certificate, can I still participate in the live Zoomcamp sessions?",data-engineering-zoomcamp,2ed9b986
Are the recordings for each Zoomcamp available even if I join outside the live cohort?,data-engineering-zoomcamp,2ed9b986
What's the difference between a live cohort and self-paced learning for these Zoomcamps?,data-engineering-zoomcamp,2ed9b986
"Do the materials and curriculum change significantly between different years for the same Zoomcamp (e.g., Data-Engineering in 2023 vs 2024)?",data-engineering-zoomcamp,2ed9b986
"If I start the Machine Learning Zoomcamp in October, will I be able to finish it before the next Data-Engineering Zoomcamp starts in January?",data-engineering-zoomcamp,2ed9b986
Will the assignments and projects also be different given the change in tools?,data-engineering-zoomcamp,93e2c8ed
Are the re-recorded Terraform videos significantly improved compared to the previous versions?,data-engineering-zoomcamp,93e2c8ed
Where can I find the old Prefect materials from the 2023 cohort?,data-engineering-zoomcamp,93e2c8ed
What specific advantages does Mage AI offer over Prefect for this course?,data-engineering-zoomcamp,93e2c8ed
Will the grading rubrics be adjusted to reflect the use of Mage AI?,data-engineering-zoomcamp,93e2c8ed
Will the online platform remain accessible even after the course officially ends?,data-engineering-zoomcamp,a482086d
"If I access the materials after the course, will I still have access to any instructor support or Q&A forums?",data-engineering-zoomcamp,a482086d
How long will the course materials remain available after the course concludes?,data-engineering-zoomcamp,a482086d
Can I start working on the final capstone project before the course officially ends?,data-engineering-zoomcamp,a482086d
"Will future cohorts have significantly different course materials, or can I use previous cohorts' homeworks to prepare?",data-engineering-zoomcamp,a482086d
How responsive is the Slack channel for self-paced learners?,data-engineering-zoomcamp,eb56ae98
What kind of questions are typically *not* answered in the FAQ or Slack channel?,data-engineering-zoomcamp,eb56ae98
Are there any limitations to the support offered in self-paced mode compared to the instructor-led mode?,data-engineering-zoomcamp,eb56ae98
How accurate is the @ZoomcampQABot usually?,data-engineering-zoomcamp,eb56ae98
"If the @ZoomcampQABot and the FAQ don't answer my question, what's the next step?",data-engineering-zoomcamp,eb56ae98
"Is there a separate playlist for each year's content, or are all years included in the main playlist?",data-engineering-zoomcamp,4292531b
"If I find a video on the Github repository, will it automatically open the correct spot in the YouTube playlist?",data-engineering-zoomcamp,4292531b
Are the office hours videos included in the main playlist or a separate one?,data-engineering-zoomcamp,4292531b
The link provided seems to only be for the main playlist. Where can I find the year-specific playlists?,data-engineering-zoomcamp,4292531b
Is the Slack channel playlist always up-to-date with the YouTube playlist?,data-engineering-zoomcamp,4292531b
What constitutes a 'module' in the context of this answer?,data-engineering-zoomcamp,ea739c65
Is the 5-15 hour estimate per week inclusive of lectures and tutorials?,data-engineering-zoomcamp,ea739c65
Are the sources [source1] and [source2] available to students?,data-engineering-zoomcamp,ea739c65
How can I use the provided data to calculate my own expected time commitment?,data-engineering-zoomcamp,ea739c65
"If I have extensive prior experience in related areas, can I expect to spend less than 5 hours per week?",data-engineering-zoomcamp,ea739c65
What exactly constitutes a 'live' cohort?  Are there specific start and end dates I should be aware of?,data-engineering-zoomcamp,cb257ee5
"If I don't complete the course within a live cohort, are there any other ways to receive recognition for completing the coursework?",data-engineering-zoomcamp,cb257ee5
Can I still access the course materials in self-paced mode even if I can't get a certificate?,data-engineering-zoomcamp,cb257ee5
What happens to my project if I start it in self-paced mode and then decide to join a live cohort later?,data-engineering-zoomcamp,cb257ee5
"How many capstones are required for the certificate, and what is the nature of the peer-review process?",data-engineering-zoomcamp,cb257ee5
Will the YouTube Live stream be archived for later viewing?,data-engineering-zoomcamp,04aa4897
"If I have a question during the office hour, how will I know if it was answered?",data-engineering-zoomcamp,04aa4897
What if the Slido link isn't pinned in the YouTube chat?,data-engineering-zoomcamp,04aa4897
Are there any other ways to ask questions besides Slido during the office hours?,data-engineering-zoomcamp,04aa4897
Will the announcements on Telegram and Slack include the exact time the office hour begins?,data-engineering-zoomcamp,04aa4897
Will the recordings include the Q&A sessions during the office hours?,data-engineering-zoomcamp,9681be3b
"Where exactly will the recordings be available?  (e.g., link, platform)",data-engineering-zoomcamp,9681be3b
"What format will the recordings be in? (e.g., MP4, MOV)",data-engineering-zoomcamp,9681be3b
How long will the recordings be available after the course ends?,data-engineering-zoomcamp,9681be3b
"If I have a question during office hours but can't ask live due to technical issues, can I submit it in another way for the instructor to answer in the recording?",data-engineering-zoomcamp,9681be3b
What happens if I miss a homework deadline?,data-engineering-zoomcamp,a1daf537
Is there a penalty for late submissions?,data-engineering-zoomcamp,a1daf537
Where can I find the announcements from @Au-Tomator mentioned in the FAQ?,data-engineering-zoomcamp,a1daf537
"If the Google Sheet and the announcement have different deadlines, which one should I follow?",data-engineering-zoomcamp,a1daf537
How will I be notified about deadline changes?,data-engineering-zoomcamp,a1daf537
What exactly constitutes 'the form still being not closed'? Is there a visual indicator?,data-engineering-zoomcamp,be5bfee4
"If I submit after the deadline, but before the form closes, will I receive any penalty or reduced grade?",data-engineering-zoomcamp,be5bfee4
Where exactly on the Course page can I find the date-timestamp to confirm my submission?,data-engineering-zoomcamp,be5bfee4
"What happens if the form closes before I can submit my homework, even if it's only a few minutes late?",data-engineering-zoomcamp,be5bfee4
"Are there any exceptions to the no late submissions policy, such as documented medical emergencies?",data-engineering-zoomcamp,be5bfee4
"Can we collaborate on homework assignments, and if so, how should we handle contributions and credit?",data-engineering-zoomcamp,0e424a44
"Is there a preferred platform (GitHub, GitLab, Bitbucket) for submitting homework, or can we use any?",data-engineering-zoomcamp,0e424a44
What constitutes a 'reasonable person' in the context of homework submission?  How detailed should our commit messages be?,data-engineering-zoomcamp,0e424a44
"If we use a private repository, how do we provide access to you for grading?",data-engineering-zoomcamp,0e424a44
"If I'm having technical difficulties with my chosen platform (e.g., Git issues), what support is available?",data-engineering-zoomcamp,0e424a44
Is there a point system for participation in class discussions?,data-engineering-zoomcamp,29865466
How are the points for 'Learning in Public' awarded specifically?  What constitutes a valid link?,data-engineering-zoomcamp,29865466
"If a homework assignment has different sections or parts with varying point values, how is the total score calculated for that assignment?",data-engineering-zoomcamp,29865466
"Are there any penalties for late homework submissions, and how does that affect the points awarded?",data-engineering-zoomcamp,29865466
"Will the leaderboard reflect points in real-time after homework submission and grading, or is there a delay?",data-engineering-zoomcamp,29865466
Can I change my display name after the course has started?,data-engineering-zoomcamp,016d46a1
"If I don't see my name on the leaderboard, does that mean I haven't submitted any homework?",data-engineering-zoomcamp,016d46a1
Is there a way to find out my random assigned name if I've forgotten it?,data-engineering-zoomcamp,016d46a1
"My display name isn't showing up in the Edit Course Profile section, what should I do?",data-engineering-zoomcamp,016d46a1
How often is the leaderboard updated?,data-engineering-zoomcamp,016d46a1
"If Python 3.9 is recommended for simplicity, what are the main compatibility issues I might encounter using Python 3.11?",data-engineering-zoomcamp,47972cb1
Are there any specific libraries or packages that might have problems with Python 3.9 that work better on 3.10 or 3.11?,data-engineering-zoomcamp,47972cb1
"The FAQ says 3.10 and 3.11 should work, but are there any features from those versions that aren't covered in the course materials?",data-engineering-zoomcamp,47972cb1
Will you provide support if I encounter errors due to using Python 3.10 or 3.11 instead of 3.9?,data-engineering-zoomcamp,47972cb1
"What are the advantages of using Python 3.11 over 3.9, beyond just newer features, considering the FAQ's emphasis on simplicity and stability?",data-engineering-zoomcamp,47972cb1
What specific challenges might Windows users encounter when setting up the course environment locally?,data-engineering-zoomcamp,ddf6c1b3
"If I choose to use Docker, are there any specific Docker versions or configurations recommended?",data-engineering-zoomcamp,ddf6c1b3
Are there any pre-configured images available for setting up the environment in a VM or Codespace?,data-engineering-zoomcamp,ddf6c1b3
What are the advantages and disadvantages of using GitHub Codespaces compared to a cloud VM like GCP?,data-engineering-zoomcamp,ddf6c1b3
"The FAQ mentions setting up on a cloud VM, but which cloud platforms are officially supported besides GCP?",data-engineering-zoomcamp,ddf6c1b3
Can I use other IDEs besides GitHub Codespaces with this course?,data-engineering-zoomcamp,ac25d3af
Are there any specific Docker versions or configurations recommended for the course?,data-engineering-zoomcamp,ac25d3af
"If I encounter Docker or Python related issues within Codespaces, where can I find support?",data-engineering-zoomcamp,ac25d3af
Does using GitHub Codespaces affect the grading or submission process?,data-engineering-zoomcamp,ac25d3af
"What are the limitations of using GitHub Codespaces, if any, compared to using a local machine?",data-engineering-zoomcamp,ac25d3af
"If we don't use GitHub Codespaces, will there be any differences in grading or assessment?",data-engineering-zoomcamp,251218fc
Are there any specific configurations or setups recommended if I choose to use my own laptop environment?,data-engineering-zoomcamp,251218fc
Will the course materials and instructions accommodate different development environments besides GitHub Codespaces and GCP VMs?,data-engineering-zoomcamp,251218fc
What are the potential drawbacks or challenges of using a personal laptop instead of a cloud-based environment like GitHub Codespaces?,data-engineering-zoomcamp,251218fc
"If I encounter problems setting up my own environment, where can I find support or assistance?",data-engineering-zoomcamp,251218fc
"If I choose a local environment, will I still be able to use BigQuery?",data-engineering-zoomcamp,3c0114ce
What are the advantages and disadvantages of using GitHub Codespaces versus a local environment?,data-engineering-zoomcamp,3c0114ce
Are there any specific tutorials or guides on setting up a local environment for this course?,data-engineering-zoomcamp,3c0114ce
"Since BigQuery is part of GCP, are there any mandatory GCP components I need to learn beyond BigQuery?",data-engineering-zoomcamp,3c0114ce
"If I'm proficient in a cloud environment other than GCP, can I still use that instead?",data-engineering-zoomcamp,3c0114ce
What if the 'Run' command isn't available in my version of Windows?,data-engineering-zoomcamp,f43f5fe7
"After changing the registry value, do I need to restart my computer or VSCode?",data-engineering-zoomcamp,f43f5fe7
Where exactly can I find the 'Autorun' value within the provided registry path?  I'm having trouble locating it.,data-engineering-zoomcamp,f43f5fe7
My known_hosts file doesn't seem to exist in that location. Could it be located elsewhere on my system?,data-engineering-zoomcamp,f43f5fe7
"Is deleting the fingerprint from known_hosts a permanent solution, or will I have to do it every time I connect to the GCP VM?",data-engineering-zoomcamp,f43f5fe7
"If I choose to use AWS instead of GCP, will I still have access to all course materials and support?",data-engineering-zoomcamp,d061525d
What are the specific limitations of using a free GCP trial account for this course?,data-engineering-zoomcamp,d061525d
"Besides BigQuery, are there other GCP services essential for completing the course assignments?",data-engineering-zoomcamp,d061525d
"Do we need to pay for any services beyond the $300 GCP credit, even if we stick with GCP?",data-engineering-zoomcamp,d061525d
Will using a different cloud provider (like AWS) impact my final grade or project evaluation?,data-engineering-zoomcamp,d061525d
How long does the GCP free trial last?,data-engineering-zoomcamp,1cd01b2c
Are there any limitations to what I can do with the free trial?,data-engineering-zoomcamp,1cd01b2c
What happens after the GCP free trial ends?,data-engineering-zoomcamp,1cd01b2c
"If I use a different cloud provider, will I have to pay?",data-engineering-zoomcamp,1cd01b2c
Are there any other free resources or alternatives to cloud services that you recommend?,data-engineering-zoomcamp,1cd01b2c
"If I choose to do the course locally, which specific tools will I need to install?",data-engineering-zoomcamp,e4a7c3b0
Are there any performance differences I should expect between running things locally and on GCP?,data-engineering-zoomcamp,e4a7c3b0
Will the course materials still be relevant if I'm not using BigQuery?,data-engineering-zoomcamp,e4a7c3b0
What parts of the course will be difficult or impossible to complete without GCP or other cloud services?,data-engineering-zoomcamp,e4a7c3b0
Are there any recommended configurations for a home lab suitable for this course?,data-engineering-zoomcamp,e4a7c3b0
Can you provide any recommended AWS services for building the data pipeline and visualization components of the capstone project?,data-engineering-zoomcamp,7cd1912e
Are there any specific AWS configurations or best practices you recommend for this course?,data-engineering-zoomcamp,7cd1912e
"What are some common pitfalls students encounter when using AWS for this course, and how can I avoid them?",data-engineering-zoomcamp,7cd1912e
"Given the potential difficulty in finding AWS-experienced peers for help, are there alternative support resources available?",data-engineering-zoomcamp,7cd1912e
"Besides the capstone project, will any of the coursework directly utilize or benefit from familiarity with AWS services?",data-engineering-zoomcamp,7cd1912e
Will the Capstone calls be recorded for those who can't attend live?,data-engineering-zoomcamp,52393fb3
"How will you announce the Capstone Zoom calls – email, forum post, or both?",data-engineering-zoomcamp,52393fb3
Is there a way to submit questions in advance for the Capstone Zoom calls?,data-engineering-zoomcamp,52393fb3
"If we have questions outside of office hours and the Capstone calls, how should we contact you?",data-engineering-zoomcamp,52393fb3
Are there any planned Q&A sessions before the Capstone project begins?,data-engineering-zoomcamp,52393fb3
Is the link to the NYC Trip data the same as last year's?,data-engineering-zoomcamp,10515af5
What specific aspects of the project remain the same as last year’s?,data-engineering-zoomcamp,10515af5
Are there any updates or changes to the data since last year?,data-engineering-zoomcamp,10515af5
"If the project is the same, why are we using the 2021 data and not the 2022 data?",data-engineering-zoomcamp,10515af5
Where can we find any documentation or tutorials related to working with this dataset?,data-engineering-zoomcamp,10515af5
Where exactly did you move the 2022 material to?  Can you provide a more specific link?,data-engineering-zoomcamp,cdb86a97
"Will the 2022 repo be available for access throughout the course, or only for a certain period?",data-engineering-zoomcamp,cdb86a97
Are there any significant differences between the 2022 material and the current year's content?,data-engineering-zoomcamp,cdb86a97
"If the 2022 repo isn't deleted, why was it moved? Was it to consolidate resources?",data-engineering-zoomcamp,cdb86a97
"Is there a complete, updated index or table of contents for where all the materials, including the moved 2022 content, are located?",data-engineering-zoomcamp,cdb86a97
Can we use a programming language other than Python for the final project?,data-engineering-zoomcamp,3e0114ad
Are there any specific libraries or packages we're required to use in our project?,data-engineering-zoomcamp,3e0114ad
Is there a minimum level of functionality the final project needs to achieve?,data-engineering-zoomcamp,3e0114ad
"Will we be graded on the specific tool we use, or is it mainly about the project's outcome?",data-engineering-zoomcamp,3e0114ad
"If we choose a less common tool, will you provide additional support or resources?",data-engineering-zoomcamp,3e0114ad
"Can we use a different cloud provider altogether, like Azure, instead of GCP or a local installation?",data-engineering-zoomcamp,b2799574
"If I choose to use Airflow, will I still receive full credit for the assignments?",data-engineering-zoomcamp,b2799574
What specific aspects of the capstone project's peer review will focus on the tool choices made?,data-engineering-zoomcamp,b2799574
Are there any recommended alternatives to Mage that are easier to integrate with the course material?,data-engineering-zoomcamp,b2799574
"Since you mention support limitations for alternative stacks, what kind of support will we get if we stick to the suggested tools?",data-engineering-zoomcamp,b2799574
Does starring the repo actually help the course instructors/developers?,data-engineering-zoomcamp,2f19301f
What kind of improvements are you looking for in PRs?  Are there specific areas you'd prioritize?,data-engineering-zoomcamp,2f19301f
"If I share the course with friends, do I need to let you know? Is there a way to track this?",data-engineering-zoomcamp,2f19301f
Is there a way to contribute beyond starring and creating PRs?,data-engineering-zoomcamp,2f19301f
What's the best way to get in touch if I have a question about contributing that isn't answered here?,data-engineering-zoomcamp,2f19301f
Does 'technically it shouldn't matter' mean there might be minor OS-specific quirks I should be aware of?,data-engineering-zoomcamp,7c700adb
Are there any specific Linux distributions you recommend for the course?,data-engineering-zoomcamp,7c700adb
"If I'm using a Windows machine, are there any potential compatibility issues I should anticipate?",data-engineering-zoomcamp,7c700adb
"What software or tools are specifically required for the course, and are they compatible across all three operating systems?",data-engineering-zoomcamp,7c700adb
Last year's success with all three OSes: are there any documented examples or resources detailing how students overcame any OS-specific challenges?,data-engineering-zoomcamp,7c700adb
"What are the minimum system requirements for this course, especially regarding operating systems?",data-engineering-zoomcamp,44b14808
"Are there alternative solutions for running the *.sh files on Windows besides WSL, such as specific software or workarounds?",data-engineering-zoomcamp,44b14808
"If WSL is recommended, could you provide a step-by-step guide or link to a tutorial on how to set it up for this course?",data-engineering-zoomcamp,44b14808
"Will the later modules (module-05 and RisingWave workshop) be significantly impacted if I cannot run the *.sh files, making it impossible to complete the course?",data-engineering-zoomcamp,44b14808
"Since past cohorts seemingly overcame this issue, is there any documentation or past student experience I could consult to find potential solutions for using Windows without WSL?",data-engineering-zoomcamp,44b14808
"Is the provided Github document the only recommended resource, or are there others you might suggest?",data-engineering-zoomcamp,76e4baf6
Are there specific sections within the 'awesome-data-engineering.md' document that are most relevant to this course?,data-engineering-zoomcamp,76e4baf6
"How often is the 'awesome-data-engineering.md' document updated, and will we be notified of significant changes?",data-engineering-zoomcamp,76e4baf6
Are there any specific books listed in the document that you would consider essential reading for the course?,data-engineering-zoomcamp,76e4baf6
"If I'm unfamiliar with some of the tools mentioned in the document, are there any introductory materials or tutorials you can recommend?",data-engineering-zoomcamp,76e4baf6
Is there a difference in grading criteria between Project Attempt #1 and Project Attempt #2?,data-engineering-zoomcamp,48b533a8
"If I submit Project Attempt #1 early and it gets a failing grade, can I still use Attempt #2?",data-engineering-zoomcamp,48b533a8
Are there any penalties for using Project Attempt #2?,data-engineering-zoomcamp,48b533a8
What is the deadline for Project Attempt #2 if I fail the first attempt?,data-engineering-zoomcamp,48b533a8
"If I submit Project Attempt #1 on time and get a passing grade, do I still need to do Attempt #2?",data-engineering-zoomcamp,48b533a8
"I'm getting a 'column c.relhasoids does not exist' error in pgcli. I've tried restarting my computer and checked the pgcli documentation, but I'm still stuck.  What should I do next?",data-engineering-zoomcamp,954044d1
"I followed video 3, step 7, and now my application is crashing. The error message is very long, and I don't know what part is relevant. How can I effectively communicate this error to get help?",data-engineering-zoomcamp,954044d1
"I've uninstalled and reinstalled the application three times, and the issue persists.  The error message doesn't provide much information.  What other troubleshooting steps can I try?",data-engineering-zoomcamp,954044d1
"Where is the best place to find answers to common questions – is it better to use the Slack search, the FAQ, or the ZoomcampQABot?",data-engineering-zoomcamp,954044d1
"My code has a syntax error on line 42, but I can't figure out what's wrong. I've looked at the error message and tried to debug it, but no luck. Should I post this on Stack Overflow, and if so, how should I format my question?",data-engineering-zoomcamp,954044d1
