question,course,document
What other reasons could cause a PostgreSQL container to stop unexpectedly besides a problem with the data directory?,data-engineering-zoomcamp,a02f2039
"If deleting the data directory and restarting the container doesn't fix the issue, what troubleshooting steps should I take next?",data-engineering-zoomcamp,a02f2039
Are there any best practices to prevent PostgreSQL containers from terminating abnormally?,data-engineering-zoomcamp,a02f2039
How can I monitor the health of my PostgreSQL container to avoid this issue in the future?,data-engineering-zoomcamp,a02f2039
The FAQ mentions the -v flag for mapping the directory. What are the other important flags I should be aware of when running a PostgreSQL Docker container?,data-engineering-zoomcamp,a02f2039
What if the `sudo snap install docker` command fails?,data-engineering-zoomcamp,c6db65aa
Are there any other methods to install Docker on Ubuntu besides using snap?,data-engineering-zoomcamp,c6db65aa
Which specific versions of Ubuntu have compatibility issues with the standard Docker installation method?,data-engineering-zoomcamp,c6db65aa
"My Ubuntu version is [version number], is snap the recommended way to install Docker?",data-engineering-zoomcamp,c6db65aa
"After installing Docker via snap, how do I verify the installation and start the Docker service?",data-engineering-zoomcamp,c6db65aa
What does the error 'Couldn’t translate host name to address' specifically mean in the context of Docker Compose and PostgreSQL?,data-engineering-zoomcamp,e41b100c
The FAQ mentions checking if the postgres database is running.  How can I definitively confirm it's running beyond just checking `docker ps`?,data-engineering-zoomcamp,e41b100c
"The logs show an 'invalid record length' error. Does this indicate a problem with my database data, or is it a Docker/PostgreSQL configuration issue?",data-engineering-zoomcamp,e41b100c
"If `docker ps` doesn't show `pgdatabase` running,  the FAQ suggests using `docker ps -a`. What if `docker ps -a` still doesn't show it, or shows it as stopped?",data-engineering-zoomcamp,e41b100c
"After resolving the 'Couldn’t translate host name to address' error, how do I ensure the connection between my application and the PostgreSQL database is correctly established?",data-engineering-zoomcamp,e41b100c
How do I find the Docker Compose network name in the logs after running `docker-compose up`?,data-engineering-zoomcamp,cd0f9300
"What if I can't find the network name in the logs, are there any other ways to identify it?",data-engineering-zoomcamp,cd0f9300
My Ingestion script still fails even after changing the network name. What other troubleshooting steps should I take?,data-engineering-zoomcamp,cd0f9300
Why is Docker Compose creating a default network instead of using the one specified in my docker-compose.yml file (if I have one)?,data-engineering-zoomcamp,cd0f9300
Could you provide a more detailed explanation on how to use HeidiSQL or usql as alternatives to pgcli?,data-engineering-zoomcamp,cd0f9300
"Why does the error 'network 66ae65944d643fdebbc89bd0329f1409dec2c9e12248052f5f4c4be7d1bdc6a3 not found' appear, and what does 'd to nuke all the containers' actually do?",data-engineering-zoomcamp,7f845a1c
The FAQ suggests changing the hostname to remove hyphens.  Are there any other naming conventions I should follow when defining container hostnames in Docker Compose?,data-engineering-zoomcamp,7f845a1c
"The FAQ mentions specifying the docker network in both containers.  Where exactly in the docker-compose.yml file should this be done, and what happens if I don't?",data-engineering-zoomcamp,7f845a1c
"If I run `docker ps -a` and see multiple stopped containers, is it always safe to remove them all using the suggested method?",data-engineering-zoomcamp,7f845a1c
"The FAQ provides a solution for the 'Name does not resolve' error with the database, but what if I still encounter this issue even after following all the suggested steps and using a hyphen-free hostname?",data-engineering-zoomcamp,7f845a1c
"If I use a named volume like 'pgadmin' instead of a host path, where exactly is the data stored on the GCP instance?",data-engineering-zoomcamp,36e54439
"What if I'm not using docker-compose, but just a single docker run command for pgAdmin? How would I ensure persistent storage then?",data-engineering-zoomcamp,36e54439
The FAQ mentions GCP;  would this solution for persistent volumes work on other cloud providers like AWS or Azure?,data-engineering-zoomcamp,36e54439
Are there any performance implications associated with using named volumes versus host path volumes in this scenario?,data-engineering-zoomcamp,36e54439
"Besides Docker Volumes, are there any other methods to achieve persistent storage for pgAdmin data within a Docker container running on GCP?",data-engineering-zoomcamp,36e54439
What exactly does 'failed to fetch extensions' mean in the context of Docker?,data-engineering-zoomcamp,32e8450c
"If updating Docker doesn't fix the 'stopped_failed to fetch extensions' error, what are the exact steps for reinstalling it?",data-engineering-zoomcamp,32e8450c
How long does it usually take to reinstall Docker and refetch the images?,data-engineering-zoomcamp,32e8450c
Are there any specific files or configurations I need to back up before reinstalling Docker?,data-engineering-zoomcamp,32e8450c
"My Docker keeps crashing; could there be an issue beyond the extensions, such as insufficient system resources?",data-engineering-zoomcamp,32e8450c
What happens if the pgAdmin_data folder doesn't exist before running docker-compose up?,data-engineering-zoomcamp,96606db2
"If I use a different username and group in my container, how should I adjust the chown command?",data-engineering-zoomcamp,96606db2
Can I use a different path for the volume on the host machine?  What are the implications?,data-engineering-zoomcamp,96606db2
"The FAQ mentions giving the container write access. What are the security implications of this, and are there best practices to mitigate any risks?",data-engineering-zoomcamp,96606db2
Is there a way to persist configuration without using volumes?  Are there any alternative approaches?,data-engineering-zoomcamp,96606db2
"I followed the instructions in guides/docker-without-sudo.md, but I'm still getting the permission denied error.  What else could be wrong?",data-engineering-zoomcamp,0882bfac
The docker-compose.yaml file example shows 'Pgadmin_data:' under volumes. Shouldn't it be 'pgadmin_data:'?,data-engineering-zoomcamp,0882bfac
"After adding the volume for pgAdmin, will my database connections persist even if I restart my entire Docker machine?",data-engineering-zoomcamp,0882bfac
Where exactly should I add the `volumes` section with `pgadmin_data` in my `docker-compose.yaml` file?  Before or after existing services?,data-engineering-zoomcamp,0882bfac
"If I'm using a different database system instead of pgAdmin, how would I adapt the volume creation instructions to preserve its state?",data-engineering-zoomcamp,0882bfac
Why didn't the `docker-compose` command work after adding it to my `.bashrc` even after sourcing it?,data-engineering-zoomcamp,7d067f5c
Is there a way to check which version of docker-compose is currently installed and being used?,data-engineering-zoomcamp,7d067f5c
"If I already have Docker Compose installed from another source, will the method in the 1.4.1 video conflict or overwrite it?",data-engineering-zoomcamp,7d067f5c
What are the potential issues of having a file named `docker-compose-linux-x86_64` instead of `docker-compose`?,data-engineering-zoomcamp,7d067f5c
The FAQ says to rename `docker-compose-linux-x86_64` to `docker-compose`.  Is this a safe operation and will it not break anything?,data-engineering-zoomcamp,7d067f5c
Why did installing 'pass' resolve the Docker Compose credential error?,data-engineering-zoomcamp,ff352621
"Is 'sudo apt install pass' the only solution for this Docker Compose error, or are there alternatives?",data-engineering-zoomcamp,ff352621
"The link provided mentions BuildKit;  is this error specifically related to BuildKit, or could it occur with other Docker setups?",data-engineering-zoomcamp,ff352621
"If I'm not using a Linux system, how would I address this Docker Compose credential issue?",data-engineering-zoomcamp,ff352621
Will installing 'pass' affect other applications or system settings?  Are there any potential side effects?,data-engineering-zoomcamp,ff352621
What should I do if I get a different error message than those mentioned in the FAQ regarding docker-compose.yml?,data-engineering-zoomcamp,2d653208
The FAQ mentions creating a new volume.  Does it matter what name I give this volume?,data-engineering-zoomcamp,2d653208
The attachment for the modified docker-compose.yml file isn't showing up. Where can I find it?,data-engineering-zoomcamp,2d653208
"The FAQ says to set `low_memory=False`. What happens if I don't, and what are the potential consequences?",data-engineering-zoomcamp,2d653208
"Step (2) says to ensure no other containers are running. How do I check what containers are currently running, and how do I stop them if needed?",data-engineering-zoomcamp,2d653208
Where exactly is the Users/username/.docker directory located? I'm having trouble finding it on my system.,data-engineering-zoomcamp,f09ea61e
My config.json file doesn't have a 'credsStore' field. What should I do then?,data-engineering-zoomcamp,f09ea61e
"After changing 'credStore' to 'credsStore', the error persists.  Are there any other troubleshooting steps?",data-engineering-zoomcamp,f09ea61e
Is there a way to fix this without modifying the config.json file directly? Perhaps a command-line solution?,data-engineering-zoomcamp,f09ea61e
"My Docker Desktop is up-to-date, and I still get this error. Could it be related to other software conflicts?",data-engineering-zoomcamp,f09ea61e
What if `uname -s` doesn't return Linux? What should I do then?,data-engineering-zoomcamp,fbd3d2bb
Is there a way to check my docker-compose version after I've installed it?,data-engineering-zoomcamp,fbd3d2bb
The command `sudo curl ...`  gave me an error.  How can I troubleshoot this?,data-engineering-zoomcamp,fbd3d2bb
Why is it important to use the correct `docker-compose` binary for WSL?,data-engineering-zoomcamp,fbd3d2bb
Are there any other ways to install `docker-compose` besides using the curl command?,data-engineering-zoomcamp,fbd3d2bb
Is there a way to troubleshoot other undefined volume errors besides the dtc_postgres_volume_local example?,data-engineering-zoomcamp,0b014d0c
What if I have multiple undefined volumes? Do I need to add each one individually as shown in the example?,data-engineering-zoomcamp,0b014d0c
My docker-compose file is different from the video's; how can I adapt the solution to my specific situation?,data-engineering-zoomcamp,0b014d0c
The error message isn't exactly the same as the example.  What other potential error messages might indicate an undefined volume?,data-engineering-zoomcamp,0b014d0c
"If I'm not using Windows or WSL, could I still encounter this undefined volume error, and if so, how would I resolve it?",data-engineering-zoomcamp,0b014d0c
"What are the specific steps to install psycopg2 using pip, and where should I run this command?",data-engineering-zoomcamp,6afb7b55
"If I'm not using Git Bash or a Windows VM, will pgAdmin still work, or are there other potential issues?",data-engineering-zoomcamp,6afb7b55
"Besides psycopg2, are there other libraries that might be needed for pgAdmin to work correctly within a Docker container?",data-engineering-zoomcamp,6afb7b55
The FAQ mentions 'libpq' is needed; what is libpq and how do I ensure it's installed correctly?,data-engineering-zoomcamp,6afb7b55
"Is there a comprehensive guide or tutorial that details the process of setting up Postgres, pgAdmin, and psycopg2 within a Docker environment, addressing potential compatibility issues?",data-engineering-zoomcamp,6afb7b55
"If I update Windows Terminal and Security, but the error persists, what other troubleshooting steps should I take?",data-engineering-zoomcamp,b51c3b82
Are there specific versions of Windows Terminal or WSL that are known to work best with this module?,data-engineering-zoomcamp,b51c3b82
"My system is quite low on disk space. Could that be contributing to the 'insufficient system resources' error, even if I update everything?",data-engineering-zoomcamp,b51c3b82
The FAQ mentions restarting the system. How long should I wait after updating before restarting?,data-engineering-zoomcamp,b51c3b82
"The FAQ focuses on Windows updates.  What if I'm using a different operating system for WSL, like Ubuntu?  Will the same solutions apply?",data-engineering-zoomcamp,b51c3b82
"What does 'reg add' actually do in the context of the DNS fix, and why are we changing the 'Start' value twice?",data-engineering-zoomcamp,326af690
Solution 2 mentions switching to Linux containers; does this mean I need to have both Windows and Linux containers enabled in Docker for this to work?,data-engineering-zoomcamp,326af690
"The FAQ mentions 'bash: conda: command not found'.  Is this a separate issue from the WSL problem, or could it be related?",data-engineering-zoomcamp,326af690
"The error 'Database is uninitialized and superuser password is not specified' appears twice.  What database is this referring to, and how do I initialize it and set a password?",data-engineering-zoomcamp,326af690
"If neither Solution 1 nor Solution 2 works, are there any other troubleshooting steps I can take to resolve the WSL exit code 1 issue?",data-engineering-zoomcamp,326af690
Why does using `sudo` before the ssh command sometimes work to fix the permissions issue?,data-engineering-zoomcamp,c2ec9047
"If copying the .ssh folder doesn't work, what other troubleshooting steps can I take?",data-engineering-zoomcamp,c2ec9047
What are the specific permissions I should set for the files and folders within the WSL2 .ssh directory?,data-engineering-zoomcamp,c2ec9047
My username in Windows is different from my username on the GPC VM.  How should I adapt the `cp` command in this scenario?,data-engineering-zoomcamp,c2ec9047
"The FAQ mentions using `chmod 600 gpc`.  Is 'gpc' the filename of my private key, or should I replace it with my actual private key filename?",data-engineering-zoomcamp,c2ec9047
"If I'm using a different Linux distribution in WSL,  will the instructions for creating the .ssh/config file still be the same?",data-engineering-zoomcamp,3b711e73
My WSL2 home directory seems different from what's described. How do I locate the correct home directory to create the .ssh folder?,data-engineering-zoomcamp,3b711e73
"What if I already have an .ssh folder in my WSL2 home directory, but I'm still getting the 'Could not resolve host name' error? Should I replace my existing config file?",data-engineering-zoomcamp,3b711e73
The FAQ mentions using the GPC VM external IP. Where can I find this IP address?,data-engineering-zoomcamp,3b711e73
"After I create the .ssh/config file with the correct information,  what steps should I take to test the connection to the GPC VM?",data-engineering-zoomcamp,3b711e73
"If changing to socket doesn't work, what other troubleshooting steps can I take for the PGCLI connection error?",data-engineering-zoomcamp,cfe07c9d
"The FAQ shows using 'root' as the username. Is this the standard username for all PostgreSQL setups in this module, or should I be using a different username?",data-engineering-zoomcamp,cfe07c9d
The example uses the database 'ny_taxi'.  Where can I find instructions on creating this database if it doesn't already exist?,data-engineering-zoomcamp,cfe07c9d
The FAQ only provides the command line.  Are there any GUI tools or alternative methods to connect to the PostgreSQL database using pgcli?,data-engineering-zoomcamp,cfe07c9d
Does the  `-h 127.0.0.1` always refer to localhost? What would I do if my database server is on a different machine?,data-engineering-zoomcamp,cfe07c9d
What does 'sy' refer to in the answer for the PGCLI --help error?,data-engineering-zoomcamp,acf42bb8
"If the PGCLI --help error isn't due to installation, what other reasons could cause it?",data-engineering-zoomcamp,acf42bb8
Are there any specific troubleshooting steps for PGCLI installation issues beyond checking 'sy'?,data-engineering-zoomcamp,acf42bb8
What are the prerequisites for using PGCLI in the context of this module?,data-engineering-zoomcamp,acf42bb8
Is there a more detailed explanation of the PGCLI command and its expected behavior?,data-engineering-zoomcamp,acf42bb8
"If I don't map port 5432, do I then need to run pgcli inside a Docker container?",data-engineering-zoomcamp,176ce516
What are the security implications of mapping port 5432 directly to my host machine?,data-engineering-zoomcamp,176ce516
"Are there any advantages to running pgcli inside a Docker container, even if port 5432 is mapped?",data-engineering-zoomcamp,176ce516
This explanation mentions accessing the database 'directly from your computer'.  Does this mean I need to have PostgreSQL installed locally?,data-engineering-zoomcamp,176ce516
"If I'm working on a project that requires multiple PostgreSQL databases, should I still map port 5432 for each, or is there a better approach?",data-engineering-zoomcamp,176ce516
"If I'm not using MacOS, how can I identify and stop a local Postgres service that's blocking port 5432?",data-engineering-zoomcamp,3e5d1e9b
"The FAQ mentions using 'pgcli -h localhost -p 5431 -u root -d ny_taxi', but what if my database name isn't 'ny_taxi'? How do I adjust the command?",data-engineering-zoomcamp,3e5d1e9b
"The FAQ suggests changing the port to 5431, but what if that port is also occupied? How can I find an available port and adjust the Docker command accordingly?",data-engineering-zoomcamp,3e5d1e9b
"I tried changing the port, but I'm still getting the password authentication error.  What are some other potential reasons for this, besides a conflicting local Postgres instance?",data-engineering-zoomcamp,3e5d1e9b
The FAQ references a video (1.4.2) for more detail.  Are there any written supplementary materials that explain port mapping and networking in Docker in more detail?,data-engineering-zoomcamp,3e5d1e9b
